{
  "environment": {
    "go_version": "go1.27.0",
    "goarch": "arm64",
    "goos": "linux"
  },
  "findings": [
    {
      "asset": "decision_integrity",
      "category": "evasion",
      "expected": "challenge_pass_never_confirms_human",
      "id": "browser_challenge_humanity_evasion",
      "remediation_status": "not_required",
      "status": "passed",
      "test_refs": [
        "internal/detector/baseline_test.go#TestSolvedChallengeIsNotHumanEvidence"
      ]
    },
    {
      "asset": "decision_integrity",
      "category": "evasion",
      "expected": "verified_identity_cannot_override_abuse_intent",
      "id": "verified_crawler_intent_evasion",
      "remediation_status": "not_required",
      "status": "passed",
      "test_refs": [
        "internal/policy/engine_test.go#TestVerifiedBotPolicyBoundaries"
      ]
    },
    {
      "asset": "trusted_signal_boundary",
      "category": "poisoning",
      "expected": "reject_noncanonical_or_inconsistent_signal",
      "id": "signed_edge_payload_poisoning",
      "remediation_status": "not_required",
      "status": "passed",
      "test_refs": [
        "pkg/palisadeedge/envelope_test.go#TestClosedCanonicalPayloadRejectsPoisoning"
      ]
    },
    {
      "asset": "trusted_signal_boundary",
      "category": "poisoning",
      "expected": "reject_uncompiled_or_invalid_policy",
      "id": "signed_policy_threshold_poisoning",
      "remediation_status": "not_required",
      "status": "passed",
      "test_refs": [
        "internal/policy/bundle_test.go#TestPolicyBundleRejectsThresholdAndSchemaPoisoning"
      ]
    },
    {
      "asset": "challenge_capability",
      "category": "proof_relay",
      "expected": "reject_replay_or_binding_mismatch",
      "id": "native_challenge_redemption_relay",
      "remediation_status": "not_required",
      "status": "passed",
      "test_refs": [
        "internal/httpapi/server_test.go#TestNativeChallengeHTTPFlowRecordsOutcomeAndRejectsReplay"
      ]
    },
    {
      "asset": "challenge_capability",
      "category": "proof_relay",
      "expected": "bind_grant_to_target_sequence_session_and_instance",
      "id": "origin_flow_binding_relay",
      "remediation_status": "not_required",
      "status": "passed",
      "test_refs": [
        "pkg/palisadehttp/middleware_test.go#TestOriginChallengeBindingIsTargetSequenceAndInstanceBound"
      ]
    },
    {
      "asset": "session_continuity",
      "category": "session_reset",
      "expected": "new_session_is_isolated_and_not_verified",
      "id": "anonymous_session_reset",
      "remediation_status": "not_required",
      "status": "passed",
      "test_refs": [
        "internal/session/memory_test.go#TestSessionIdentifiersDoNotShareContinuityState",
        "internal/detector/baseline_test.go#TestUnsignedSessionCannotCreateVerifiedContinuityEvidence"
      ]
    },
    {
      "asset": "session_continuity",
      "category": "session_reset",
      "expected": "expire_receipt_and_start_fresh_sequence",
      "id": "expired_event_receipt_reset",
      "remediation_status": "not_required",
      "status": "passed",
      "test_refs": [
        "internal/events/store_test.go#TestIngestReceiptResetsAfterSessionTTL"
      ]
    },
    {
      "asset": "bounded_availability",
      "category": "resource_exhaustion",
      "expected": "evict_within_fixed_capacity",
      "id": "session_store_capacity_exhaustion",
      "remediation_status": "not_required",
      "status": "passed",
      "test_refs": [
        "internal/session/memory_test.go#TestStoreEvictsAtCapacity"
      ]
    },
    {
      "asset": "bounded_availability",
      "category": "resource_exhaustion",
      "expected": "fail_closed_without_published_output",
      "id": "offline_import_budget_exhaustion",
      "remediation_status": "not_required",
      "status": "passed",
      "test_refs": [
        "internal/offlineimport/importer_test.go#TestHardBudgetsFailClosedWithoutPublishedOutput"
      ]
    },
    {
      "asset": "rollout_authority",
      "category": "rollout_compromise",
      "expected": "reject_tampered_or_mismatched_rollout",
      "id": "signed_rollout_tampering",
      "remediation_status": "not_required",
      "status": "passed",
      "test_refs": [
        "internal/rollout/rollout_test.go#TestPrepareVerifyAndTamper"
      ]
    },
    {
      "asset": "rollout_authority",
      "category": "rollout_compromise",
      "expected": "downgrade_expired_rollout_to_shadow",
      "id": "expired_rollout_reuse",
      "remediation_status": "not_required",
      "status": "passed",
      "test_refs": [
        "internal/rollout/rollout_test.go#TestExpiredControllerFailsClosed"
      ]
    }
  ],
  "limitations": [
    "synthetic regression controls only; not an independent penetration test or security audit",
    "uses no deployment, customer or production traffic records",
    "does not measure unknown attack classes, detection efficacy or false-positive rates",
    "does not scan a public or live target",
    "passing named controls does not establish the absence of vulnerabilities",
    "operating-system network isolation is an operator boundary and is not attested by this JSON record"
  ],
  "protocol": {
    "category_count": 6,
    "go_test_count": 1,
    "module_downloads_disabled": true,
    "publication_requires_all_passed": true,
    "scenario_count": 12
  },
  "raw_deployment_records_used": false,
  "schema_version": "palisade.synthetic-red-team-findings.v1",
  "source_commit": "25aaba71094e59c76930d9062a69526659a6e38e",
  "suite_sha256": "2a8790ec99beb06bc98739e45e9b5e364b1d95deac5f40a97e1fb6258a0cf0ef",
  "suite_version": "palisade.red-team-suite.v1",
  "summary": {
    "failed": 0,
    "passed": 12,
    "remediations_open": 0
  },
  "synthetic_only": true
}
